<?xml version="1.0" encoding="UTF-8" standalone="yes"?>
<DISCIPLINE name="Nethermancer" lang="en" xmlns="http://earthdawn.com/discipline" xmlns:xsi="http://www.w3.org/2001/XMLSchema-instance" xmlns:edt="http://earthdawn.com/datatypes" xsi:schemaLocation="http://earthdawn.com/discipline ../earthdawndiscipline.xsd">
	<DURABILITY circle="1" death="4" unconsciousness="3"/>
	<OPTIONALTALENT name="Acarne Mutterings" circle="1"/>
	<OPTIONALTALENT name="Read/Write Language" circle="1"/>
	<OPTIONALTALENT name="Silent Walk" circle="1"/>
	<OPTIONALTALENT name="Speak Language" circle="1"/>
	<OPTIONALTALENT name="Spell Matrix" circle="1"/>
	<DISCIPLINETALENT name="Astral Sight" circle="1"/>
	<DISCIPLINETALENT name="Karma Ritual" circle="1"/>
	<DISCIPLINETALENT name="Read/Write Magic" circle="1"/>
	<DISCIPLINETALENT name="Spellcasting" circle="1"/>
	<DISCIPLINETALENT name="Spell Matrix" circle="1"/>
	<DISCIPLINETALENT name="Thread Weaving" circle="1" limitation="Nethermancy"/>
	<SPELL name="Astral Spear" circle="1"/>
	<SPELL name="Bone Dance" circle="1"/>
	<SPELL name="Chilling Circle" circle="1"/>
	<SPELL name="Command Nightflyer" circle="1"/>
	<SPELL name="Detect Undead" circle="1"/>
	<SPELL name="Dry and Wet" circle="1"/>
	<SPELL name="Experience Death" circle="1"/>
	<SPELL name="Insect Repellent" circle="1"/>
	<SPELL name="Mount Scare" circle="1"/>
	<SPELL name="Puterfy" circle="1"/>
	<SPELL name="Spirit Dart" circle="1"/>
	<SPELL name="Spirit Grip" circle="1"/>
	<SPELL name="Undead Struggle" circle="1"/>
	<OPTIONALTALENT name="Animal Possession" circle="2"/>
	<OPTIONALTALENT name="Blood Share" circle="2"/>
	<OPTIONALTALENT name="Creature Analysis" circle="2"/>
	<OPTIONALTALENT name="Dominate Beast" circle="2"/>
	<OPTIONALTALENT name="Durability" circle="2" limitation="4/3"/>
	<OPTIONALTALENT name="Frighten Animals" circle="2"/>
	<OPTIONALTALENT name="Spell Matrix" circle="2"/>
	<OPTIONALTALENT name="Spell Matrix" circle="2"/>
	<DISCIPLINETALENT name="Frighten" circle="2"/>
	<SPELL name="Bone Cirlce" circle="2"/>
	<SPELL name="Detect Nethermance Magic" circle="2"/>
	<SPELL name="Etherreal Darkness" circle="2"/>
	<SPELL name="Fog Ghost" circle="2"/>
	<SPELL name="Life Circle of One" circle="2"/>
	<SPELL name="Pocket Guardian" circle="2"/>
	<SPELL name="Repel Animal" circle="2"/>
	<SPELL name="Shadow's Whisper" circle="2"/>
	<SPELL name="Shield Mist" circle="2"/>
	<SPELLABILITY circle="2"/>
	<DEFENSE kind="spell" circle="2"/>
	<DISCIPLINETALENT name="Spirit Talk" circle="3"/>
	<SPELL name="Arrow of Night" circle="3"/>
	<SPELL name="Dark Messenger" circle="3"/>
	<SPELL name="Death Trance" circle="3"/>
	<SPELL name="Death's Head" circle="3"/>
	<SPELL name="Dispel Nethermancy Magic" circle="3"/>
	<SPELL name="Fog of Fear" circle="3"/>
	<SPELL name="Grave Message" circle="3"/>
	<SPELL name="Pack Bages" circle="3"/>
	<SPELL name="Pain" circle="3"/>
	<SPELL name="Preserve" circle="3"/>
	<SPELL name="Shadow Meld" circle="3"/>
	<SPELL name="Spirit Double" circle="3"/>
	<SPELL name="Summon Bone Ghost" circle="3"/>
	<SPELLABILITY circle="3"/>
	<DISCIPLINETALENT name="Spirit Hold" circle="4"/>
	<SPELL name="Animate Skeleton" circle="4"/>
	<SPELL name="Astral Flare" circle="4"/>
	<SPELL name="Blood Servitor" circle="4"/>
	<SPELL name="Dark Spy" circle="4"/>
	<SPELL name="Evil Eye" circle="4"/>
	<SPELL name="Fatal Food" circle="4"/>
	<SPELL name="Friend of Foe" circle="4"/>
	<SPELL name="Last Chance" circle="4"/>
	<SPELL name="Nightflyer's Cloak" circle="4"/>
	<SPELL name="Spirit Servant" circle="4"/>
	<SPELL name="Viewpoint" circle="4"/>
	<SPELL name="Visions if Death" circle="4"/>
	<SPELLABILITY circle="4"/>
	<KARMA spend="Willpower-ony Test" circle="4"/>
	<OPTIONALTALENT name="Abate Curse" circle="5"/>
	<OPTIONALTALENT name="Elemental Tongues" circle="5"/>
	<OPTIONALTALENT name="Enhanced Matrix" circle="5"/>
	<OPTIONALTALENT name="Enhanced Matrix" circle="5"/>
	<OPTIONALTALENT name="Item History" circle="5"/>
	<OPTIONALTALENT name="Lion Heart" circle="5"/>
	<OPTIONALTALENT name="Steel Thought" circle="5"/>
	<OPTIONALTALENT name="Willforce" circle="5"/>
	<DISCIPLINETALENT name="Summon" circle="5" limitation="Ally Spirits"/>
	<SPELL name="Animate Spirti Object" circle="5"/>
	<SPELL name="Astral Horror" circle="5"/>
	<SPELL name="Astral Mount" circle="5"/>
	<SPELL name="Astral Whisper" circle="5"/>
	<SPELL name="Blind" circle="5"/>
	<SPELL name="Circle of Atral Protection" circle="5"/>
	<SPELL name="Incessant Talking" circle="5"/>
	<SPELL name="Pass Ward" circle="5"/>
	<SPELL name="Sculpt Darkness" circle="5"/>
	<SPELL name="Sense Horror" circle="5"/>
	<SPELL name="Shadow Hunter" circle="5"/>
	<SPELL name="Spiritual Guidance" circle="5"/>
	<SPELL name="Star Shower" circle="5"/>
	<SPELL name="Target Portal" circle="5"/>
	<SPELL name="Tears of the Scourge" circle="5"/>
	<SPELL name="Whisper Through the Night" circle="5"/>
	<SPELL name="Wither Limb" circle="5"/>
	<SPELLABILITY circle="5"/>
	<ABILITY name="Decay and Renewal" circle="5"/>
	<DISCIPLINETALENT name="Lifesight" circle="6"/>
	<SPELL name="Blessed Light" circle="6"/>
	<SPELL name="Bone Puppet" circle="6"/>
	<SPELL name="Bone Shatter" circle="6"/>
	<SPELL name="Bone Walker" circle="6"/>
	<SPELL name="Dust to Dust" circle="6"/>
	<SPELL name="Foul Vapors" circle="6"/>
	<SPELL name="Friendly Darkness" circle="6"/>
	<SPELL name="Recovery" circle="6"/>
	<SPELL name="Soul Armor" circle="6"/>
	<SPELL name="Wall of Darkness" circle="6"/>
	<SPELLABILITY circle="6"/>
	<KARMA spend="Perseption-Only Tests" circle="6"/>
	<DISCIPLINETALENT name="Spirit Dodge" circle="7"/>
	<SPELL name="Astral Beacon" circle="7"/>
	<SPELL name="Atral Maw" circle="7"/>
	<SPELL name="Banquet of Dis" circle="7"/>
	<SPELL name="Bone Pudding" circle="7"/>
	<SPELL name="Cold Storage" circle="7"/>
	<SPELL name="Constrict Heart" circle="7"/>
	<SPELL name="Damage Shift" circle="7"/>
	<SPELL name="Marathon Run" circle="7"/>
	<SPELL name="Restrain Entity" circle="7"/>
	<SPELL name="Reverse Withering" circle="7"/>
	<SPELL name="Spirit Bold" circle="7"/>
	<SPELL name="Spirit Portal" circle="7"/>
	<SPELL name="Steal Strength" circle="7"/>
	<SPELL name="Step Though Shadow" circle="7"/>
	<SPELL name="Wit Friend" circle="7"/>
	<KARMA spend="spell effect tests" circle="7"/>
	<DISCIPLINETALENT name="Orbiting Spy" circle="8"/>
	<SPELL name="Control Being" circle="8"/>
	<SPELL name="Globe of Silence" circle="8"/>
	<SPELL name="Horror Call" circle="8"/>
	<SPELL name="Netherblade" circle="8"/>
	<SPELL name="Restrain Horror" circle="8"/>
	<SPELL name="Shadow Tether" circle="8"/>
	<SPELL name="Translator Spirit" circle="8"/>
	<SPELL name="Visit Death" circle="8"/>
	<SPELL name="Wall of Bones" circle="8"/>
	<SPELL name="Wither Away" circle="8"/>
	<DEFENSE circle="8" kind="spell"/>
	<OPTIONALTALENT name="Animate Object" circle="9"/>
	<OPTIONALTALENT name="Armored Matrix" circle="9"/>
	<OPTIONALTALENT name="Armored Matrix" circle="9"/>
	<OPTIONALTALENT name="Atral Pocket" circle="9"/>
	<OPTIONALTALENT name="Cold Purify" circle="9"/>
	<OPTIONALTALENT name="Life Check" circle="9"/>
	<OPTIONALTALENT name="Matrix Strike" circle="9"/>
	<OPTIONALTALENT name="Steely Stare" circle="9"/>
	<DISCIPLINETALENT name="Bargain with Summoned Creatured" circle="9"/>
	<SPELL name="Create Life" circle="9"/>
	<SPELL name="Dark Sword" circle="9"/>
	<SPELL name="Disrupt Magic" circle="9"/>
	<SPELL name="Mystic Vessel" circle="9"/>
	<SPELL name="Shift Skin" circle="9"/>
	<SPELL name="Silent Darkness" circle="9"/>
	<SPELL name="Talent Shredder" circle="9"/>
	<SPELL name="Void Wave" circle="9"/>
	<SPELL name="Walking Dead" circle="9"/>
	<KARMA spend="Recovery Tests" circle="9"/>
	<ABILITY name="Otherworldly Control" circle="9"/>
	<DISCIPLINETALENT name="Summoning Circle" circle="10"/>
	<SPELL name="Animate Dead" circle="10"/>
	<SPELL name="Atrale Slice" circle="10"/>
	<SPELL name="Damage Transfer" circle="10"/>
	<SPELL name="Fragile Pattern" circle="10"/>
	<SPELL name="Gateway" circle="10"/>
	<SPELL name="Soul Trap" circle="10"/>
	<SPELL name="Spirit Tempest" circle="10"/>
	<SPELL name="Strong Pattern" circle="10"/>
	<SPELL name="Tap Horror Karma" circle="10"/>
	<DEFENSE circle="10" kind="spell"/>
	<KARMA spend="Action Tests made by a spirit or creature und his control" circle="10"/>
	<DISCIPLINETALENT name="Netherwalk" circle="11"/>
	<SPELL name="Alter Life" circle="11"/>
	<SPELL name="Shatter Pattern" circle="11"/>
	<SPELL name="Unnatural Life" circle="11"/>
	<DEFENSE circle="11" kind="social"/>
	<DEFENSE circle="11" kind="physical"/>
	<DISCIPLINETALENT name="Bone Compass" circle="12"/>
	<SPELL name="Forge Falsemen" circle="12"/>
	<SPELL name="Pervert Emotion" circle="12"/>
	<DEFENSE circle="12" kind="spell"/>
	<RECOVERYTEST circle="12"/>
	<OPTIONALTALENT name="Etherreal Weapon" circle="13"/>
	<OPTIONALTALENT name="Second Chance" circle="13"/>
	<OPTIONALTALENT name="Shared Matrix" circle="13"/>
	<OPTIONALTALENT name="Shared Matrix" circle="13"/>
	<OPTIONALTALENT name="Wound Transfer" circle="13"/>
	<DISCIPLINETALENT name="Spell Crystal Lock" circle="13"/>
	<SPELL name="Erease Horror Mark" circle="13"/>
	<SPELL name="Eternal Youth" circle="13"/>
	<DEFENSE circle="13" kind="social"/>
	<KARMASTEP circle="13"/>
	<ABILITY name="Astral Face" circle="13"/>
	<DISCIPLINETALENT name="Multi-Weaving" circle="14"/>
	<SPELL name="Call Foth the Army of Decay" circle="14"/>
	<DEFENSE circle="14" kind="spell"/>
	<RECOVERYTEST circle="14"/>
	<DISCIPLINETALENT name="Soul Shatter" circle="15"/>
	<DEFENSE circle="15" kind="social"/>
	<DEFENSE circle="15" kind="physical"/>
	<INITIATIVE circle="15"/>
	<INITIATIVE circle="15"/>
</DISCIPLINE>
