<?xml version="1.0" encoding="UTF-8" standalone="yes"?>
<DISCIPLINE  name="Warrior" lang="en" xmlns="http://earthdawn.com/discipline" xmlns:xsi="http://www.w3.org/2001/XMLSchema-instance" xmlns:edt="http://earthdawn.com/datatypes" xsi:schemaLocation="http://earthdawn.com/discipline ../earthdawndiscipline.xsd">
	<OPTIONALTALENT name="Acrobatic Strike" circle="1"/>
	<OPTIONALTALENT name="Air Dance" circle="1"/>
	<OPTIONALTALENT name="Climbing" circle="1"/>
	<OPTIONALTALENT name="Maneuver" circle="1"/>
	<OPTIONALTALENT name="Parry" circle="1"/>
	<DISZIPLINETALENT name="Avoid Blow" circle="1"/>
	<DISZIPLINETALENT name="Karma Ritual" circle="1"/>
	<DISZIPLINETALENT name="Melee Weapons" circle="1"/>
	<DISZIPLINETALENT name="Unarmed Combat" circle="1"/>
	<DISZIPLINETALENT name="Wood Skin" circle="1"/>
	<OPTIONALTALENT name="Detect Weapon" circle="2"/>
	<OPTIONALTALENT name="Durability" circle="2" limitation="9/7"/>
	<OPTIONALTALENT name="Fireblood" circle="2"/>
	<OPTIONALTALENT name="Heartening Laugh" circle="2"/>
	<OPTIONALTALENT name="Missile Weapons" circle="2"/>
	<OPTIONALTALENT name="Swift Kick" circle="2"/>
	<OPTIONALTALENT name="Throwing Weapons" circle="2"/>
	<OPTIONALTALENT name="Tiger Spring" circle="2"/>
	<DEFENSE kind="physical" circle="2"/>
	<DISZIPLINETALENT name="Anticipate Blow" circle="2"/>
	<DISZIPLINETALENT name="Wound Balance" circle="3"/>
	<KARMA spend="Strength-only Test" circle="4"/>
	<DISZIPLINETALENT name="Thread Weaving" circle="4" limitation="War Weaving"/>
	<OPTIONALTALENT name="Cobra Strike" circle="5"/>
	<OPTIONALTALENT name="Disarm" circle="5"/>
	<OPTIONALTALENT name="Leadership" circle="5"/>
	<OPTIONALTALENT name="Lion Heart" circle="5"/>
	<OPTIONALTALENT name="Second Weapon" circle="5"/>
	<OPTIONALTALENT name="Shield Charge" circle="5"/>
	<OPTIONALTALENT name="Steel Stare" circle="5"/>
	<OPTIONALTALENT name="Tactics" circle="5"/>
	<ABILITY name="Batte Rites" circle="5"/>
	<DISZIPLINETALENT name="Temper Self" circle="5"/>
	<KARMA spend="Dexterity-ony Test" circle="6"/>
	<DISZIPLINETALENT name="Life Check" circle="6"/>
	<KARMA spend="close combat Damage Test" circle="7"/>
	<DISZIPLINETALENT name="Crushing Blow" circle="7"/>
	<DEFENSE kind="physical" circle="8"/>
	<DISZIPLINETALENT name="Second Attack" circle="8"/>
	<OPTIONALTALENT name="Battle Bellow" circle="9"/>
	<OPTIONALTALENT name="Body Blade" circle="9"/>
	<OPTIONALTALENT name="Critical Hit" circle="9"/>
	<OPTIONALTALENT name="Frenzy" circle="9"/>
	<OPTIONALTALENT name="Matrix Strike" circle="9"/>
	<OPTIONALTALENT name="Shield Beater" circle="9"/>
	<OPTIONALTALENT name="Spirit Strike" circle="9"/>
	<OPTIONALTALENT name="Steel Thought" circle="9"/>
	<ABILITY name="Battlefield Awareness" circle="9"/>
	<KARMA spend="Recovery Test" circle="9"/>
	<DISZIPLINETALENT name="Earth Skin" circle="9"/>
	<DEFENSE kind="physical" circle="10"/>
	<KARMA spend="Willpower-only Test" circle="10"/>
	<DISZIPLINETALENT name="Resist Pain" circle="10"/>
	<DEFENSE kind="physical" circle="11"/>
	<DEFENSE kind="social" circle="11"/>
	<DISZIPLINETALENT name="Vitality" circle="11"/>
	<DEFENSE kind="physical" circle="12"/>
	<DISZIPLINETALENT name="Unmount" circle="12"/>
	<OPTIONALTALENT name="Etherreal Weapon" circle="13"/>
	<OPTIONALTALENT name="Mind Blade" circle="13"/>
	<OPTIONALTALENT name="Rushing Attack" circle="13"/>
	<OPTIONALTALENT name="Second Chance" circle="13"/>
	<OPTIONALTALENT name="Vital Strike" circle="13"/>
	<OPTIONALTALENT name="Weapon Beater" circle="13"/>
	<ABILITY name="Resurrect Self" circle="13"/>
	<DEFENSE kind="spell" circle="13"/>
	<INITIATIVE circle="13"/>
	<DISZIPLINETALENT name="Stone Skin" circle="13"/>
	<DEFENSE kind="physical" circle="14"/>
	<INITIATIVE circle="13"/>
	<DISZIPLINETALENT name="Multi-Strike" circle="14"/>
	<DEFENSE kind="spell" circle="15"/>
	<DEFENSE kind="social" circle="15"/>
	<DISZIPLINETALENT name="Aura Armor" circle="15"/>
</DISCIPLINE>
